{
  "file": "heightmap.raw",
  "resolution": 513,
  "format": "uint16 little-endian, row-major",
  "row0": "south edge (min z); col0 = west edge (min x)",
  "size_m": [
    400.0,
    400.0
  ],
  "origin": [
    -200.0,
    -200.0
  ],
  "min_height_m": -80.311,
  "max_height_m": 9.454,
  "height_range_m": 89.765,
  "note": "world_y = min_height_m + value/65535 * height_range_m. Unity: terrain size = (size_m[0], height_range_m, size_m[1]), position y = min_height_m; may need 'Flip Vertically' depending on importer."
}